{
  "schema": "panlabs-aws-diagrams/theme@1",
  "id": "light",
  "label": "Claro (padrão)",
  "because": "O default. Branco puro porque a régua não deixa escolher outra coisa: `#ED7100` — a cor de Compute, Containers, Media e das bordas de Auto Scaling, EC2 instance contents, Beanstalk e Spot Fleet — só alcança os 3:1 da WCAG 1.4.11 contra `#FFFFFF`. Tudo o mais é o preset da AWS intocado.",
  "background": "light"
}
